M-1-0277,10534,,,,,,Standard,Regular,,527,Riya Mobile Center,"Rabeya Nazrul Super Market, kalkini, Madaripur, Post code: 7920, City: Madaripur",Madaripur Sadar,Madaripur,01711507909
M-1-0277,10535,,,,,,Standard,Regular,,1740,Fantasy & Gift Corner,"126/1. Uttar Mugdapara. Basher Tower. Sobujbag. Dhaka, Post code: 1214, City: Dhaka",Jatrabari,Dhaka,01711281875
M-1-0277,10536,,,,,,Standard,Regular,,329,Mahia Telecom,"Goila Rothkhola Agailjhara Barisal, Post code: 8241, City: Barishal",Barisal,Barisal,01716621601
M-1-0277,10537,,,,,,Standard,Regular,,479,New Mobile Center,"Boro Station Road .Chandpur Sadar. Chandpur, Post code: 3600, City: Chandpur",Chandpur Sadar,Chandpur,01820528422
M-1-0277,10538,,,,,,Standard,Regular,,299,Xplore Communication,"Trishal Bus Stand. Dhaka Road. Trishal. Mymensingh, Post code: 2200, City: Mymensingh",Mymensingh,Mymensingh,01711461186
M-1-0277,10539,,,,,,Standard,Regular,,1590,Mayer Doa Telecom,"23/3, East Madartek, Bashabo, Sabujbag,
 Dhaka., Post code: 1214, City: Dhaka",Sabujbag,Dhaka,01794040907
M-1-0277,10540,,,,,,Standard,Regular,,4105,Bondhu Telecom,"Moyendia Bazar, Boalmari, Faridpur, Post code: 7860, City: Faridpur",Faridpur Sadar,Faridpur,01711282818
M-1-0277,10543,,,,,,Standard,Regular,,214,Al - Amin Telecom,"Rabeya Nazrul Super Market, Kalkini, Madaripur, Post code: 7920, City: Madaripur",Madaripur Sadar,Madaripur,01711507909
M-1-0277,10544,,,,,,Standard,Regular,,1850,Shawan Enterprise,"Shop-33. Road-16. Comport Housing. Adabor. Dhaka, Post code: 1207, City: Dhaka",Adabor ,Dhaka,01712276967
M-1-0277,10545,,,,,,Standard,Regular,,824,Mohammad ali,"loharpol, puran bazar, chandpur, Post code: 3601, City: Chandpur",Chandpur Sadar,Chandpur,01711160020
M-1-0277,10546,,,,,,Standard,Regular,,1690,M/s. Fani Store,"JFCL Coloni. Tarakandi. Sorishabari. Jamalpur, Post code: 2000, City: Jamalpur",Jamalpur Sadar,Jamalpur,01716054466
M-1-0277,10547,,,,,,Standard,Regular,,249,Mim Telecom,"Rabeya Nazrul Super Market, Kalkini, Madaripur, Post code: 7920, City: Madaripur",Madaripur Sadar,Madaripur,01711507909
M-1-0277,10548,,,,,,Standard,Regular,,417,Rana Telecom & Computer,"Bottala Pal Para.Track Road.Chandpur, Post code: 3600, City: Chandpur",Chandpur Sadar,Chandpur,01836285060
M-1-0277,10550,,,,,,Standard,Regular,,417,Miazi Telecom Center,"Matlab Road. Babur Haat. Chandpur Sadar. Chandpur., Post code: 3600, City: Chandpur",Chandpur Sadar,Chandpur,01732691006
M-1-0277,10551,,,,,,Standard,Regular,,339,Mim Telecom,"Rabeya Nazrul super Market, Kalkini, Madaripur, Post code: 7920, City: Madaripur",Madaripur Sadar,Madaripur,01711507909
M-1-0277,10552,,,,,,Standard,Regular,,940,Mobile Garden,"Kalibari Road. Keshabpur. Jessore, Post code: 7450, City: Jessore",Jessore Sadar,Jessore,01711326780
M-1-0277,10553,,,,,,Standard,Regular,,420,Bismillah Lub House,"Proprietor: Md. Raju
 Trishal Bus stand, Dorirampur
 Trishal, Mymensingh., Post code: 2220, City: Mymensingh",Mymensingh,Mymensingh,1782303000
M-1-0277,10554,,,,,,Standard,Regular,,249,M/S Matri Saya Telecom & Cosmetics,"Rabeya Nazrul Super Market, kalkini, Madaripur, Post code: 7920, City: Madaripur",Madaripur Sadar,Madaripur,01711507909
M-1-0277,10555,,,,,,Standard,Regular,,2150,Opi Telecom & Mobile Servicing Center & Photoghar,"Vill-Ambari Bazar.PO-Ambari.PS-Dowara.Dist-Sunamganj, Post code: 3000, City: Sunamganj",Sunamganj Sadar,Sunamganj,01784754848
M-1-0277,10556,,,,,,Standard,Regular,,4805,Kulsum Telecom,"Mondomala hat, Post code: 6230, City: Rajshahi",Rajshahi,Rajshahi,01740610400
M-1-0277,10557,,,,,,Standard,Regular,,399,M/S Sagorika Store,"Rabeya Nazrul Super Market, Kalkini, Madaripur, Post code: 7921, City: Madaripur",Madaripur Sadar,Madaripur,01711507909
M-1-0277,10558,,,,,,Standard,Regular,,414,Sayed Library & Mobile Center,"Buztola Bazar. Kalaroa. Satkhira., Post code: 9410, City: Satkhira",Satkhira Sadar,Satkhira,01736561456
M-1-0277,10559,,,,,,Standard,Regular,,1555,Billal Telecom,"138/24. East Rampura. Rampura. Dhaka-1219., Post code: 1219, City: Dhaka",rampura,Dhaka,01715521755
M-1-0277,10563,,,,,,Standard,Regular,,0,Ali store,"Goalabazar,osmani nogor,sylhet, Post code: 3124, City: Sylhet",Jalalabad,Sylhet,01712869595
M-1-0277,10564,,,,,,Standard,Regular,,614,S.S Telecom,"Semans hostel, laila voban, bondor, ctg, Post code: 4000, City: Chittagong",Kotwali,Chittagong,01714576101
M-1-0277,10566,,,,,,Standard,Regular,,0,Ali store,"Goalabazar,osmani nogor,sylhet, Post code: 3124, City: Sylhet",Jalalabad,Sylhet,01712869595
M-1-0277,10567,,,,,,Standard,Regular,,0,Ali store,"Goalabazar,osmani nogor,sylhet, Post code: 3124, City: Sylhet",Jalalabad,Sylhet,01712869595
M-1-0277,10568,,,,,,Standard,Regular,,1724,Asha Mobile Sales & Serving Center,"Ataikula Bazar. santhia. Pabna, Post code: 6670, City: Pabna",Pabna Sadar,Pabna,01712396260
M-1-0277,10569,,,,,,Standard,Regular,,1339,muhammad saddam hussain,"kotbari,mohammadia telecom,, Post code: 3503, City: Comilla",Comilla,Comilla,01717685000
M-1-0277,10570,,,,,,Standard,Regular,,1677,Mobile Dot Net,"Goala Bazar. Osmaninagar. Sylhet., Post code: 3100, City: Sylhet",Jalalabad,Sylhet,01717908084
M-1-0277,10572,,,,,,Standard,Regular,,"1,540",Maa Telecom,"15/GA-Mirrertek. Mirbagh. Moghbazar Dhaka-1217., Post code: 1217, City: Dhaka",Shahbag,Dhaka,01719532913
M-1-0277,10573,,,,,,Standard,Regular,,1620,Niaz Telecom,"Sharmara Bazar. Bakshiganj. Jamalpur, Post code: 2000, City: Jamalpur",Jamalpur Sadar,Jamalpur,01716707077
M-1-0277,10574,,,,,,Standard,Regular,,795,Nafees Imtiaz,"Cosmopolitan R/A Nasirabab,Panchlaish, Post code: 4210, City: Chittagong",Kotwali,Chittagong,1860566506
M-1-0277,10576,,,,,,Standard,Regular,,615,Mintu Electronics & VCD Centre,"Baunia . Turag. Dhaka., Post code: 1230, City: Dhaka",Turag,Dhaka,01715478587
M-1-0277,10580,,,,,,Standard,Regular,,1405,Banna Telecom Center,"Kopara Bas stand Demra, Post code: 1360, City: Dhaka",Demra,Dhaka,01683058823
M-1-0277,10581,,,,,,Standard,Regular,,840,Sumaiya Islam,"938 East Monipur, Mirpur 2, Dhaka1216, Post code: 1216, City: Dhaka",Mirpur,Dhaka,1764046393
M-1-0277,10582,,,,,,Standard,Regular,,5220,Grameen Point,"Dakkin aicha,charfassin, Bhola, Post code: 8300, City: Bhola",Bhola Sadar,Bhola,01711166040
M-1-0277,10584,,,,,,Standard,Regular,,528,Rony Telecom,"Mobarakpur.Shibganj. Chapai Nawabganj, Post code: 6341, City: Chapinawabganj",Chapainawabganj Sadar,Chapainawabganj,01724025163
M-1-0277,10585,,,,,,Standard,Regular,,1564,Labu Telecome Center,"Barinagoar Bazer,Jessore Sadar, Post code: 7400, City: Jessore",Jessore Sadar,Jessore,01711470279
M-1-0277,10586,,,,,,Standard,Regular,,199,Altara Polliphone,"Barogachi Bazar. Shibganj. Chapai Nawabganj, Post code: 6321, City: Chapinawabganj",Chapainawabganj Sadar,Chapainawabganj,01713706920
M-1-0277,10588,,,,,,Standard,Regular,,997,Grameen castomar & bai bai audio,"Nangolkot Bazar. Nangolkot Powroshova. Nangolkot. Comilla., Post code: 3500, City: Comilla",Comilla,Comilla,01711199900
M-1-0277,10589,,,,,,Standard,Regular,,1915,Tahmid Bostraloy & Telecom,"Hamidpur. Ghatail. Tangail., Post code: 1970, City: Tangail",Tangail Sadar,Tangail,01715090741
M-1-0277,10591,,,,,,Standard,Regular,,1149,Md samim ahmed,"akol miah market poil road hobiganj, Post code: 3300, City: Hobiganj",Habiganj Sadar,Habiganj,1717280910
M-1-0277,10595,,,,,,Standard,Regular,,0,Sangita Mobile Hospital & Digital Studio,"Shangita Road. Chourastar Mor. Narsingdi sadar. Narsingdi, Post code: 1600, City: Narshingdi",Narsingdi Sadar,Narsingdi,01750031631
M-1-0277,10596,,,,,,Standard,Regular,,984,M/S Razzak Telecom,"Keramot  Ali Plaza. Gopalganj, Post code: 8100, City: Gopalganj",Gopalganj Sadar,Gopalganj,01724386709
M-1-0277,10598,,,,,,Standard,Regular,,1587,Ma Telecom,"Forkethat. Rajarhat. Kurigram, Post code: 5600, City: Kurigram",Kurigram Sadar,Kurigram,01738290429
M-1-0277,10599,,,,,,Standard,Regular,,2071,A R. Telecom,"Shibgonj Bazer. Sylhet Sadar, Post code: 3100, City: Sylhet",Jalalabad,Sylhet,01777610610
M-1-0277,10601,,,,,,Standard,Regular,,2000,Fikand Telecom,"Vhaitkandhi Bazar .Phulpur.Mymensingh, Post code: 2200, City: Mymensingh",Mymensingh,Mymensingh,01740637922
M-1-0277,10603,,,,,,Standard,Regular,,2330,Sawpon Telecom,"Khogar Hat, Khaga Khoribari. Dimla. Nilphamari, Post code: 5351, City: Nilphamari",Nilphamari Sadar,Nilphamari,01712956266
M-1-0277,10606,,,,,,Standard,Regular,,1663,Al Amin Telecom.,"Baganbari Chowrasta Bazaar. Madhupur. Tangail., Post code: 1996, City: Tangail",Tangail Sadar,Tangail,01747129248
M-1-0277,10607,,,,,,Standard,Regular,,2250,Five Star Telecom,"Pourasova Market. Shibganj. Chapai Nawabganj, Post code: 6300, City: Chapinawabganj",Chapainawabganj Sadar,Chapainawabganj,01713705090
M-1-0277,10608,,,,,,Standard,Regular,,2063,Bahar Telecom,"Shimer Bazar Fothepur. Sylhet, Post code: 3100, City: Sylhet",Jalalabad,Sylhet,1740371362
M-1-0277,10609,,,,,,Standard,Regular,,1575,Parents Telecom,"Bismillah plaza, Shipahipara Chowrasta. Rampal, Munshigonj., Post code: 1500, City: Munshiganj",Munshigonj Sadar,Munshiganj,01970006161
M-1-0277,10610,,,,,,Standard,Regular,,2650,Janani Telecom,"Choddoshoto Bazar, Kishoregonj, Post code: 2300, City: Kishoreganj",Kishoregonj Sadar,Kishoreganj,01711963017
M-1-0277,10611,,,,,,Standard,Regular,,599,SL Business Point,"Chitolia Somiter Hat, Sorder Bari, Shariatpur, Post code: 8000, City: Shariatpur",Shariatpur Sadar,Shariatpur,1911129994
M-1-0277,10615,,,,,,Standard,Regular,,1525,Mahmuda Fashion,"Ratanpur, Shafipur, Kaliakoir, Gazipur, Post code: 1751, City: Gazipur",Gazipur,Gazipur,01772015773
M-1-0277,10618,,,,,,Standard,Regular,,2150,Risha Enterprise,"Chor Anupnagar.Nawabganj Sadar.Chapai Nawabganj, Post code: 6300, City: Chapinawabganj",Chapainawabganj Sadar,Chapainawabganj,01726432553
M-1-0277,10619,,,,,,Standard,Regular,,1752,abdul jolil,"grameenphone express, jolsukha bazar, ajmirigonj ,hobigonj, Post code: 3360, City: Hobiganj",Habiganj Sadar,Habiganj,1711853384
M-1-0277,10620,,,,,,Standard,Regular,,859,Maa Telecom & Sarvicing Senter,"Hakimuddin.Burhanuddin.Bhola, Post code: 8320, City: Bhola",Bhola Sadar,Bhola,1710640564
M-1-0277,10622,,,,,,Standard,Regular,,1678,Nila Telecom,"Arkandi. Gowainghat. Sylhet, Post code: 3100, City: Sylhet",Jalalabad,Sylhet,01710891000
M-1-0277,10625,,,,,,Standard,Regular,,2838,Mita Varieties Store And Grameen Phone,"boharpur bazzar, Post code: 7730, City: Rajbari",Rajbari Sadar,Rajbari,01711351462
M-1-0277,10626,,,,,,Standard,Regular,,1890,M/S. Maa Enterprise,"New Busterminal. Tangail, Post code: 1900, City: Tangail",Tangail Sadar,Tangail,01731841932
M-1-0277,10627,,,,,,Standard,Regular,,1520,Bahar Stote,"Horipur to Biman Bandar Road, Shimar Bazar, Gowainghat, Sylhet-3100, Post code: 3100, City: Sylhet",Jalalabad,Sylhet,1740371362
M-1-0277,10629,,,,,,Standard,Regular,,2040,Sagor Computer,"Manikgong Bazar.Lohagora. Narail., Post code: 7511, City: Narail",Narail Sadar,Narail,01710876077
M-1-0277,10632,,,,,,Standard,Regular,,213,Mitul kumar Baroi,"M R Road .Grameenphonecenter. Magura, Post code: 7600, City: Magura",Magura,Magura,1718454813
M-1-0277,10635,,,,,,Standard,Regular,,1605,Bithi Telecom,"Dhokin Shom.Kaligonj. Gazipur, Post code: 1720, City: Gazipur",Gazipur,Gazipur,01743912265
M-1-0277,10636,,,,,,Standard,Regular,,3975,Shahin Brothers Telecom,"Sarkar Bazar Bus Stand. Moulvibazar. Sylhet, Post code: 3200, City: Moulvibazar",Moulvibazar Sadar,Moulvibazar,01715358735
M-1-0277,10637,,,,,,Standard,Regular,,1890,Khan Mobile Point,"Station Bazar. Gomastapur. Chapai Nawabganj, Post code: 6320, City: Chapinawabganj",Chapainawabganj Sadar,Chapainawabganj,01740578209
M-1-0277,10639,,,,,,Standard,Regular,,6000,Shamsuddin Sagor,"Shirajonj, Shahjadpur ,abdul hamid market, Post code: 6770, City: Sirajganj",Sirajganj Sadar,Sirajganj,01725868848
M-1-0277,10640,,,,,,Standard,Regular,,1835,Azir Electronics,"Suroighat. Kanaighat. Sylhet., Post code: 3180, City: Sylhet",Jalalabad,Sylhet,01713814547
M-1-0277,10641,,,,,,Standard,Regular,,1170,Md. Sharifuzzaman,"218/4;Basail, Narshingdi sadar, Narsingdi., Post code: 1600, City: Narshingdi",Narsingdi Sadar,Narsingdi,1676424027
M-1-0277,10642,,,,,,Standard,Regular,,1937,Bandhon Shoe Store,"Kaminigonj Bazar. Juri. Moulvibazar, Post code: 3200, City: Moulvibazar",Moulvibazar Sadar,Moulvibazar,01717141392
M-1-0277,10644,,,,,,Standard,Regular,,1359,Matile Tailaje,"Balua Bazer, Post code: 5700, City: Gaibandha",Gaibandha Sadar,Gaibandha,01789608028
M-1-0277,10646,,,,,,Standard,Regular,,399,Sumaiya Electric & Electronics,"Maleka Market, Tin Matha Moar, Mohastan, Shibganj, Bogra, Post code: 5800, City: Bogra",Bogra Sadar,Bogra,01782949596
M-1-0277,10647,,,,,,Standard,Regular,,2990,Onik Phone Fax,"Vuagati Bazar.Raigonj. Sirajgonj, Post code: 6720, City: Sirajganj",Sirajganj Sadar,Sirajganj,01711873670
M-1-0277,10648,,,,,,Standard,Regular,,958,BD20349138(GPCF Patuakhali),"GrameenPhone Center Patuakhali,Sadar Road,Launch Ghat,Patuakhali.., Post code: 8600, City: Patuakhali",Patuakhali Sadar,Patuakhali,01712016880
M-1-0277,10649,,,,,,Standard,Regular,,3154,Sirius Enterprise,"New Medical Road. Kajalshah. Sylhet., Post code: 3100, City: Sylhet",Jalalabad,Sylhet,1737962590
M-1-0277,10650,,,,,,Standard,Regular,,1864,Bondhu Telecom & Computer,"Aushnara.Moterbazar.Madhupur.Tangail, Post code: 1996, City: Tangail",Tangail Sadar,Tangail,01713538405
M-1-0277,10651,,,,,,Standard,Regular,,189,Md. Joynal Abedin,"Grameenphonecenter , Old Busstand , Kanaikhali , Natore ,6400, Post code: 6400, City: Natore",Natore Sadar,Natore,1707078777
M-1-0277,10652,,,,,,Standard,Regular,,2360,Ma Babar Doa Digital Studio,"Charchatila Bazaar.Gopalpur.Tangail, Post code: 1900, City: Tangail",Tangail Sadar,Tangail,01713583727
M-1-0277,10653,,,,,,Standard,Regular,,681,M/S Oishe Telecom,"Kaligong Bazar, Debiganj , Panchagarh., Post code: 5020, City: Panchagarh",Panchagarh Sadar,Panchagarh,01740927194
M-1-0277,10654,,,,,,Standard,Regular,,1449,Khaja Telecom,"Katgore Bazar. North Potenga. Chittagong, Post code: 4204, City: Chittagong",Kotwali,Chittagong,01711374470
M-1-0277,10655,,,,,,Standard,Regular,,3058,Bhai Bhai Store,"Makrai bazar. Ghatail. Tangail., Post code: 1900, City: Tangail",Tangail Sadar,Tangail,01795274287
M-1-0277,10657,,,,,,Standard,Regular,,2225,Biswas Telecom,"Ramdia Bazar. Kashiani. Gopalganj, Post code: 8131, City: Gopalganj",Gopalganj Sadar,Gopalganj,01716624131
M-1-0277,10659,,,,,,Standard,Regular,,360,FAISAL CHOWDHURY,"Chowdhury Villa,Plot No-98,Road No-4,
 Mujgunni R/A Boyra Khulna, Post code: 9000, City: Khulna",khulna kotwali,khulna,1711217127
M-1-0277,10660,,,,,,Standard,Regular,,1130,Mahmudul Hasan,"House - 84 , road -02, Block A, flat no 1A ,Basundhara Residential Area. Dhaka, Post code: 1229, City: Dhaka",Banani,Dhaka,01711500048
M-1-0277,10662,,,,,,Standard,Regular,,1766,M/S Shanto Computer & Electronics,"Jorshimul Bazar.Dhunat.Bogra., Post code: 5850, City: Bogra",Bogra Sadar,Bogra,01729968148
M-1-0277,10663,,,,,,Standard,Regular,,289,Mridul Mobile Center,"Juluher.Moishani.Nesarabad.Pirojpur, Post code: 8523, City: Pirojpur",Pirojpur Sadar,Pirojpur,01711219524
M-1-0277,10667,,,,,,Standard,Regular,,529,Nahar Mobile Collection,"Besides of Chuna Factory. Artilary more. Halishahar. Chitagong., Post code: 4000, City: Chittagong",Kotwali,Chittagong,01715922555
M-1-0277,9794,,,,,,Standard,Regular,,3310,Atik Telecom,"Tukerbazar. Companigonj, Post code: 3140, City: Sylhet",Jalalabad,Sylhet,01726080400
M-1-0277,10173,,,,,,Standard,Regular,,0,Sojun Sharker,"Nagoriakandi, UMC Jute Mills
 Narsingdi Sadar
 Narsingdi-1601, Post code: 1600, City: Narshingdi",Narsingdi Sadar,Narsingdi,01711733922
M-1-0277,10363,,,,,,Standard,Regular,,1325,Kulsuma Mobile Servicing Center,"Milongonj Bazar.PO-Tarapasha.PS-Derai.Dist-Sunamgonj, Post code: 3000, City: Sunamganj",Sunamganj Sadar,Sunamganj,01730083873
